id;name;price;date
Т-000081885;kompyuternaya-tehnika;Акустика JBL CHARGE 5 White;3399;Sat Dec 17 2022 07:16:10 GMT+0200 (Восточная Европа, стандартное время)
Т-000081887;kompyuternaya-tehnika;Bluetooth наушники JBL T130NC TWS White;1499;Sat Dec 17 2022 07:16:10 GMT+0200 (Восточная Европа, стандартное время)
Т-000081888;kompyuternaya-tehnika;Bluetooth наушники JBL T225 TWS Black;1899;Sat Dec 17 2022 07:16:10 GMT+0200 (Восточная Европа, стандартное время)
Т-000081884;kompyuternaya-tehnika;Портативный аккумулятор Swissten (10 000 мА*ч);699;Sat Dec 17 2022 07:16:10 GMT+0200 (Восточная Европа, стандартное время)
Т-000081883;kompyuternaya-tehnika;Портативный аккумулятор Swissten (30 000 мА*ч);1199;Sat Dec 17 2022 07:16:10 GMT+0200 (Восточная Европа, стандартное время)
Т-000081890;kompyuternaya-tehnika;Акустика JBL Xtreme 3 Blue;5299;Sat Dec 17 2022 07:16:10 GMT+0200 (Восточная Европа, стандартное время)
Т-000081892;kompyuternaya-tehnika;МФУ лазерный Canon i-SENSYS MF453dw (5161C007);9999;Sat Dec 17 2022 07:16:10 GMT+0200 (Восточная Европа, стандартное время)
Т-000081891;kompyuternaya-tehnika;МФУ лазерный Canon i-SENSYS MF455DW (5161C006);11199;Sat Dec 17 2022 07:16:10 GMT+0200 (Восточная Европа, стандартное время)
Т-000066322;kompyuternaya-tehnika;Беспр. наушники Technics EAH-AZ40G-K;1659;Sat Dec 17 2022 07:16:10 GMT+0200 (Восточная Европа, стандартное время)
Т-000081740;kompyuternaya-tehnika;Apple AirPods PRO with MagSafe Charging Case (2rd Gen) (MQD83);5999;Sat Dec 17 2022 07:16:10 GMT+0200 (Восточная Европа, стандартное время)
Т-000081769;kompyuternaya-tehnika;Корпус AeroCool CS-107 Black;899;Sat Dec 17 2022 07:16:10 GMT+0200 (Восточная Европа, стандартное время)
Т-000081771;kompyuternaya-tehnika;Корпус Be Quiet Pure Base 600 Black (BG021);2399;Sat Dec 17 2022 07:16:10 GMT+0200 (Восточная Европа, стандартное время)
Т-000081216;kompyuternaya-tehnika;Планшет Samsung GALAXY TAB A8 X200 3/32GB WiFi Pink Gold (SM-X200NIDEEUB);4399;Sat Dec 17 2022 07:16:10 GMT+0200 (Восточная Европа, стандартное время)
Т-000081751;kompyuternaya-tehnika;Планшет Samsung GALAXY TAB A8 X205 4/64GB LTE Silver (SM-X205NZSEEUC);5399;Sat Dec 17 2022 07:16:10 GMT+0200 (Восточная Европа, стандартное время)
Т-000081746;kompyuternaya-tehnika;Планшет Samsung GALAXY TAB A8 X205 4/64GB LTE Grey (SM-X205NZSEEUE);5399;Sat Dec 17 2022 07:16:10 GMT+0200 (Восточная Европа, стандартное время)
Т-000081741;kompyuternaya-tehnika;Геймпад Microsoft xBox Series X/S/One (QAU-00002) Wireless blue;1599;Sat Dec 17 2022 07:16:10 GMT+0200 (Восточная Европа, стандартное время)
Т-000081595;kompyuternaya-tehnika;Ноутбук MSI GF76 Katana Black (12UE-681XPL);33999;Sat Dec 17 2022 07:16:10 GMT+0200 (Восточная Европа, стандартное время)
Т-000081766;kompyuternaya-tehnika;Apple HomePod mini Yellow;2999;Sat Dec 17 2022 07:16:10 GMT+0200 (Восточная Европа, стандартное время)
Т-000081765;kompyuternaya-tehnika;Apple HomePod mini White;2999;Sat Dec 17 2022 07:16:10 GMT+0200 (Восточная Европа, стандартное время)
Т-000081763;kompyuternaya-tehnika;Apple HomePod mini Space Gray;2999;Sat Dec 17 2022 07:16:10 GMT+0200 (Восточная Европа, стандартное время)
Т-000081767;kompyuternaya-tehnika;Apple HomePod mini Orange;2999;Sat Dec 17 2022 07:16:10 GMT+0200 (Восточная Европа, стандартное время)
Т-000081764;kompyuternaya-tehnika;Apple HomePod mini Blue;2999;Sat Dec 17 2022 07:16:10 GMT+0200 (Восточная Европа, стандартное время)
Т-000081768;kompyuternaya-tehnika;Портативный аккумулятор ADATA 20 000 мАч 18W QCD (AP20000QCD-DGT-CWH);999;Sat Dec 17 2022 07:16:10 GMT+0200 (Восточная Европа, стандартное время)
Т-000081742;kompyuternaya-tehnika;Портативный аккумулятор Silicon Power GP28 Black (10 000 мА*ч);499;Sat Dec 17 2022 07:16:10 GMT+0200 (Восточная Европа, стандартное время)
